{
  "$schema": "https://fsantibanezleal.github.io/PitStudio/contracts/road-network.schema.json",
  "type": "FeatureCollection",
  "schema_version": "1.0",
  "frame": "site-enu",
  "site_origin": {
    "epsg": 26912,
    "easting_m": 406500.0,
    "northing_m": 4484500.0,
    "z0_m": 1800.0
  },
  "provenance": "design-code",
  "exit_node": "n0",
  "features": [
    {
      "type": "Feature",
      "id": "n0",
      "geometry": {
        "type": "Point",
        "coordinates": [
          500.0,
          0.0,
          0.0
        ]
      },
      "properties": {
        "kind": "node",
        "role": "exit"
      }
    },
    {
      "type": "Feature",
      "id": "n1",
      "geometry": {
        "type": "Point",
        "coordinates": [
          500.0,
          187.5,
          -15.0
        ]
      },
      "properties": {
        "kind": "node",
        "role": "junction"
      }
    },
    {
      "type": "Feature",
      "id": "n2",
      "geometry": {
        "type": "Point",
        "coordinates": [
          500.0,
          375.0,
          -30.0
        ]
      },
      "properties": {
        "kind": "node",
        "role": "end"
      }
    },
    {
      "type": "Feature",
      "id": "n3",
      "geometry": {
        "type": "Point",
        "coordinates": [
          450.0,
          187.5,
          -15.0
        ]
      },
      "properties": {
        "kind": "node",
        "role": "end"
      }
    },
    {
      "type": "Feature",
      "id": "e0",
      "geometry": {
        "type": "LineString",
        "coordinates": [
          [
            500.0,
            0.0,
            0.0
          ],
          [
            500.0,
            93.75,
            -7.5
          ],
          [
            500.0,
            187.5,
            -15.0
          ]
        ]
      },
      "properties": {
        "kind": "edge",
        "from": "n0",
        "to": "n1",
        "class": "ramp",
        "length_m": 188.099,
        "grade_mean_pct": -8.0,
        "grade_max_pct": 8.0
      }
    },
    {
      "type": "Feature",
      "id": "e1",
      "geometry": {
        "type": "LineString",
        "coordinates": [
          [
            500.0,
            187.5,
            -15.0
          ],
          [
            500.0,
            281.25,
            -22.5
          ],
          [
            500.0,
            375.0,
            -30.0
          ]
        ]
      },
      "properties": {
        "kind": "edge",
        "from": "n1",
        "to": "n2",
        "class": "ramp",
        "length_m": 188.099,
        "grade_mean_pct": -8.0,
        "grade_max_pct": 16.0
      }
    },
    {
      "type": "Feature",
      "id": "e2",
      "geometry": {
        "type": "LineString",
        "coordinates": [
          [
            500.0,
            187.5,
            -15.0
          ],
          [
            450.0,
            187.5,
            -15.0
          ]
        ]
      },
      "properties": {
        "kind": "edge",
        "from": "n1",
        "to": "n3",
        "class": "bench-road",
        "length_m": 50.0,
        "grade_mean_pct": 0.0,
        "grade_max_pct": 0.0
      }
    }
  ]
}
